{"pageProps":{"content":{"videos":[{"youtubeId":"X_8mkF4hECs","vanityId":"kbtv-9-13-16","title":"KBTV: The First Episode!","description":"This is an older episode of KBTV, published 9/13/16.","date":"2016-09-13T00:00:00.000Z","type":"full episode","show":{"showId":"kbtv","name":"KBTV","color":"#3582fe"},"season":1,"episode":1,"thumbnail":"1fa153ce624185d12ddb060fa0163573","length":["Special Episode","5:37"]},{"youtubeId":"74uFNANTjCU","vanityId":"kbtv-9-20-16","title":"KBTV Archives: S1 E2","description":"This is an older episode of KBTV, published 9/20/16.","date":"2016-09-20T00:00:00.000Z","type":"full episode","show":{"showId":"kbtv","name":"KBTV","color":"#3582fe"},"season":1,"episode":2,"thumbnail":"1fa153ce624185d12ddb060fa0163573","length":["7:00"]},{"youtubeId":"Y4Xe1vgBYE0","vanityId":"kbtv-9-27-16","title":"KBTV Archives: S1 E3","description":"This is an older episode of KBTV, published 9/27/16.","date":"2016-09-27T00:00:00.000Z","type":"full episode","show":{"showId":"kbtv","name":"KBTV","color":"#3582fe"},"season":1,"episode":3,"thumbnail":"1fa153ce624185d12ddb060fa0163573","length":["6:19"]},{"youtubeId":"GAQYLONOaPE","vanityId":"kbtv-10-11-16","title":"KBTV Archives: S1 E4","description":"This is an older episode of KBTV, published 10/11/16.","date":"2016-10-11T00:00:00.000Z","type":"full episode","show":{"showId":"kbtv","name":"KBTV","color":"#3582fe"},"season":1,"episode":4,"thumbnail":"1fa153ce624185d12ddb060fa0163573","length":["4:30"]},{"youtubeId":"mtncYfl7Kfg","vanityId":"kbtv-10-18-16","title":"KBTV Archives: S1 E5","description":"This is an older episode of KBTV, published 10/18/16.","date":"2016-10-18T00:00:00.000Z","type":"full episode","show":{"showId":"kbtv","name":"KBTV","color":"#3582fe"},"season":1,"episode":5,"thumbnail":"1fa153ce624185d12ddb060fa0163573","length":["5:47"]},{"youtubeId":"KwK9kpClAlI","vanityId":"kbtv-10-25-16","title":"KBTV Archives: S1 E6","description":"This is an older episode of KBTV, published 10/25/16.","date":"2016-10-25T00:00:00.000Z","type":"full episode","show":{"showId":"kbtv","name":"KBTV","color":"#3582fe"},"season":1,"episode":6,"thumbnail":"1fa153ce624185d12ddb060fa0163573","length":["6:09"]},{"youtubeId":"0S8e86PaYwk","vanityId":"kbtv-11-1-16","title":"KBTV Archives: S1 E7","description":"This is an older episode of KBTV, published 11/1/16.","date":"2016-11-01T00:00:00.000Z","type":"full episode","show":{"showId":"kbtv","name":"KBTV","color":"#3582fe"},"season":1,"episode":7,"thumbnail":"1fa153ce624185d12ddb060fa0163573","length":["6:28"]},{"youtubeId":"HHvos_eKO3E","vanityId":"kbtv-11-8-16","title":"KBTV Archives: S1 E8","description":"This is an older episode of KBTV, published 11/8/16.","date":"2016-11-08T00:00:00.000Z","type":"full episode","show":{"showId":"kbtv","name":"KBTV","color":"#3582fe"},"season":1,"episode":8,"thumbnail":"1fa153ce624185d12ddb060fa0163573","length":["6:53"]},{"youtubeId":"GA0C0nlsinE","vanityId":"kbtv-11-15-16","title":"KBTV Archives: S1 E9","description":"This is an older episode of KBTV, published 11/15/16.","date":"2016-11-15T00:00:00.000Z","type":"full episode","show":{"showId":"kbtv","name":"KBTV","color":"#3582fe"},"season":1,"episode":9,"thumbnail":"1fa153ce624185d12ddb060fa0163573","length":["5:47"]},{"youtubeId":"3bgsDbnB2LM","vanityId":"kbtv-11-29-16","title":"KBTV Archives: S1 E10","description":"This is an older episode of KBTV, published 11/29/16.","date":"2016-11-29T00:00:00.000Z","type":"full episode","show":{"showId":"kbtv","name":"KBTV","color":"#3582fe"},"season":1,"episode":10,"thumbnail":"1fa153ce624185d12ddb060fa0163573","length":["7:04"]},{"youtubeId":"aZWU86kuk8k","vanityId":"kbtv-12-6-16","title":"KBTV Archives: S1 E11","description":"This is an older episode of KBTV, published 12/6/16.","date":"2016-12-06T00:00:00.000Z","type":"full episode","show":{"showId":"kbtv","name":"KBTV","color":"#3582fe"},"season":1,"episode":11,"thumbnail":"1fa153ce624185d12ddb060fa0163573","length":["9:32"]},{"youtubeId":"GCO3RUGU3IE","vanityId":"kbtv-12-20-16","title":"KBTV Archives: S1 E12","description":"This is an older episode of KBTV, published 12/20/16.","date":"2016-12-20T00:00:00.000Z","type":"full episode","show":{"showId":"kbtv","name":"KBTV","color":"#3582fe"},"season":1,"episode":12,"thumbnail":"1fa153ce624185d12ddb060fa0163573","length":["11:54"]},{"youtubeId":"5Mgqfq05Et8","vanityId":"kbtv-1-10-17","title":"KBTV Archives: S1 E13","description":"This is an older episode of KBTV, published 1/10/17.","date":"2017-01-10T00:00:00.000Z","type":"full episode","show":{"showId":"kbtv","name":"KBTV","color":"#3582fe"},"season":1,"episode":13,"thumbnail":"1fa153ce624185d12ddb060fa0163573","length":["5:33"]},{"youtubeId":"in0qOcs5F1U","vanityId":"kbtv-1-17-17","title":"KBTV Archives: S1 E14","description":"This is an older episode of KBTV, published 1/17/17.","date":"2017-01-17T00:00:00.000Z","type":"full episode","show":{"showId":"kbtv","name":"KBTV","color":"#3582fe"},"season":1,"episode":14,"thumbnail":"1fa153ce624185d12ddb060fa0163573","length":["8:01"]},{"youtubeId":"PTYUHSQv5nA","vanityId":"kbtv-1-24-27","title":"KBTV Archives: S1 E15","description":"This is an older episode of KBTV, published 1/24/27.","date":"2027-01-24T00:00:00.000Z","type":"full episode","show":{"showId":"kbtv","name":"KBTV","color":"#3582fe"},"season":1,"episode":15,"thumbnail":"1fa153ce624185d12ddb060fa0163573","length":["7:42"]},{"youtubeId":"TfDAzzFvoro","vanityId":"kbtv-1-31-17","title":"KBTV Archives: S1 E16","description":"This is an older episode of KBTV, published 1/31/17.","date":"2017-01-31T00:00:00.000Z","type":"full episode","show":{"showId":"kbtv","name":"KBTV","color":"#3582fe"},"season":1,"episode":16,"thumbnail":"1fa153ce624185d12ddb060fa0163573","length":["6:02"]},{"youtubeId":"KccQJlNLO7I","vanityId":"kbtv-2-7-17","title":"KBTV Archives: S1 E17","description":"This is an older episode of KBTV, published 2/7/17.","date":"2017-02-07T00:00:00.000Z","type":"full episode","show":{"showId":"kbtv","name":"KBTV","color":"#3582fe"},"season":1,"episode":17,"thumbnail":"1fa153ce624185d12ddb060fa0163573","length":["6:51"]},{"youtubeId":"0g1sIRQYzrM","vanityId":"kbtv-2-14-17","title":"KBTV Archives: S1 E18","description":"This is an older episode of KBTV, published 2/14/17.","date":"2017-02-14T00:00:00.000Z","type":"full episode","show":{"showId":"kbtv","name":"KBTV","color":"#3582fe"},"season":1,"episode":18,"thumbnail":"1fa153ce624185d12ddb060fa0163573","length":["7:36"]},{"youtubeId":"GedQJRW_Jh0","vanityId":"kbtv-2-21-17","title":"KBTV Archives: S1 E19","description":"This is an older episode of KBTV, published 2/21/17.","date":"2017-02-21T00:00:00.000Z","type":"full episode","show":{"showId":"kbtv","name":"KBTV","color":"#3582fe"},"season":1,"episode":19,"thumbnail":"1fa153ce624185d12ddb060fa0163573","length":["7:07"]},{"youtubeId":"uWS2HdyT7cU","vanityId":"kbtv-2-28-17","title":"KBTV Archives: S1 E20","description":"This is an older episode of KBTV, published 2/28/17.","date":"2017-02-28T00:00:00.000Z","type":"full episode","show":{"showId":"kbtv","name":"KBTV","color":"#3582fe"},"season":1,"episode":20,"thumbnail":"1fa153ce624185d12ddb060fa0163573","length":["5:45"]},{"youtubeId":"DLEHSYQYQD0","vanityId":"kbtv-3-7-17","title":"KBTV Archives: S1 E21","description":"This is an older episode of KBTV, published 3/7/17.","date":"2017-03-07T00:00:00.000Z","type":"full episode","show":{"showId":"kbtv","name":"KBTV","color":"#3582fe"},"season":1,"episode":21,"thumbnail":"1fa153ce624185d12ddb060fa0163573","length":["8:49"]},{"youtubeId":"yGfjT-Q0mdQ","vanityId":"kbtv-3-21-17","title":"KBTV Archives: S1 E22","description":"This is an older episode of KBTV, published 3/21/17.","date":"2017-03-21T00:00:00.000Z","type":"full episode","show":{"showId":"kbtv","name":"KBTV","color":"#3582fe"},"season":1,"episode":22,"thumbnail":"1fa153ce624185d12ddb060fa0163573","length":["7:46"]},{"youtubeId":"cMFHuAEBpLI","vanityId":"kbtv-4-4-17","title":"KBTV Archives: S1 E23","description":"This is an older episode of KBTV, published 4/4/17.","date":"2017-04-04T00:00:00.000Z","type":"full episode","show":{"showId":"kbtv","name":"KBTV","color":"#3582fe"},"season":1,"episode":23,"thumbnail":"1fa153ce624185d12ddb060fa0163573","length":["9:33"]},{"youtubeId":"1zbgnP3w_Ls","vanityId":"kbtv-4-11-17","title":"KBTV Archives: S1 E24","description":"This is an older episode of KBTV, published 4/11/17.","date":"2017-04-11T00:00:00.000Z","type":"full episode","show":{"showId":"kbtv","name":"KBTV","color":"#3582fe"},"season":1,"episode":24,"thumbnail":"1fa153ce624185d12ddb060fa0163573","length":["10:16"]},{"youtubeId":"m_S2Izl-Gi4","vanityId":"kbtv-4-18-17","title":"KBTV Archives: S1 E25","description":"This is an older episode of KBTV, published 4/18/17.","date":"2017-04-18T00:00:00.000Z","type":"full episode","show":{"showId":"kbtv","name":"KBTV","color":"#3582fe"},"season":1,"episode":25,"thumbnail":"1fa153ce624185d12ddb060fa0163573","length":["8:09"]},{"youtubeId":"kn3VwqGFuoM","vanityId":"kbtv-4-25-17","title":"KBTV Archives: S1 E26","description":"This is an older episode of KBTV, published 4/25/17.","date":"2017-04-25T00:00:00.000Z","type":"full episode","show":{"showId":"kbtv","name":"KBTV","color":"#3582fe"},"season":1,"episode":26,"thumbnail":"1fa153ce624185d12ddb060fa0163573","length":["8:49"]},{"youtubeId":"cPva_kGtM7I","vanityId":"kbtv-5-2-17","title":"KBTV Archives: S1 E27","description":"This is an older episode of KBTV, published 5/2/17.","date":"2017-05-02T00:00:00.000Z","type":"full episode","show":{"showId":"kbtv","name":"KBTV","color":"#3582fe"},"season":1,"episode":27,"thumbnail":"1fa153ce624185d12ddb060fa0163573","length":["5:46"]},{"youtubeId":"N4HYU7T7oHs","vanityId":"kbtv-5-9-17","title":"KBTV Archives: S1 E28","description":"This is an older episode of KBTV, published 5/9/17.","date":"2017-05-09T00:00:00.000Z","type":"full episode","show":{"showId":"kbtv","name":"KBTV","color":"#3582fe"},"season":1,"episode":28,"thumbnail":"1fa153ce624185d12ddb060fa0163573","length":["11:07"]},{"youtubeId":"mWeXNh2nMpU","vanityId":"kbtv-5-16-17","title":"KBTV Archives: S1 E29","description":"This is an older episode of KBTV, published 5/16/17.","date":"2017-05-16T00:00:00.000Z","type":"full episode","show":{"showId":"kbtv","name":"KBTV","color":"#3582fe"},"season":1,"episode":29,"thumbnail":"1fa153ce624185d12ddb060fa0163573","length":["6:32"]},{"youtubeId":"5efNCvy4tBY","vanityId":"kbtv-5-30-17","title":"KBTV Archives: S1 E30","description":"This is an older episode of KBTV, published 5/30/17.","date":"2017-05-30T00:00:00.000Z","type":"full episode","show":{"showId":"kbtv","name":"KBTV","color":"#3582fe"},"season":1,"episode":30,"thumbnail":"1fa153ce624185d12ddb060fa0163573","length":["8:33"]}],"noticeBoard":[{"header":"September Student Survey","description":"KNN wants your thoughts on everything from homework to Daylight Savings!","emoji":"🗳","link":"https://www.forms.gle/"},{"header":"Interviews","description":"We want YOU to be interviewed for KNN! See our available interviews and let us know if you’re interested."},{"header":"Notifications","description":"Get notified whenever we upload new content!","emoji":"🔔"}],"playlists":[{"title":"Latest Content","videos":[{"youtubeId":"PTYUHSQv5nA","vanityId":"kbtv-1-24-27","title":"KBTV Archives: S1 E15","description":"This is an older episode of KBTV, published 1/24/27.","date":"2027-01-24T00:00:00.000Z","type":"full episode","show":{"showId":"kbtv","name":"KBTV","color":"#3582fe"},"season":1,"episode":15,"thumbnail":"1fa153ce624185d12ddb060fa0163573","length":["7:42"]},{"youtubeId":"5efNCvy4tBY","vanityId":"kbtv-5-30-17","title":"KBTV Archives: S1 E30","description":"This is an older episode of KBTV, published 5/30/17.","date":"2017-05-30T00:00:00.000Z","type":"full episode","show":{"showId":"kbtv","name":"KBTV","color":"#3582fe"},"season":1,"episode":30,"thumbnail":"1fa153ce624185d12ddb060fa0163573","length":["8:33"]},{"youtubeId":"mWeXNh2nMpU","vanityId":"kbtv-5-16-17","title":"KBTV Archives: S1 E29","description":"This is an older episode of KBTV, published 5/16/17.","date":"2017-05-16T00:00:00.000Z","type":"full episode","show":{"showId":"kbtv","name":"KBTV","color":"#3582fe"},"season":1,"episode":29,"thumbnail":"1fa153ce624185d12ddb060fa0163573","length":["6:32"]},{"youtubeId":"N4HYU7T7oHs","vanityId":"kbtv-5-9-17","title":"KBTV Archives: S1 E28","description":"This is an older episode of KBTV, published 5/9/17.","date":"2017-05-09T00:00:00.000Z","type":"full episode","show":{"showId":"kbtv","name":"KBTV","color":"#3582fe"},"season":1,"episode":28,"thumbnail":"1fa153ce624185d12ddb060fa0163573","length":["11:07"]},{"youtubeId":"cPva_kGtM7I","vanityId":"kbtv-5-2-17","title":"KBTV Archives: S1 E27","description":"This is an older episode of KBTV, published 5/2/17.","date":"2017-05-02T00:00:00.000Z","type":"full episode","show":{"showId":"kbtv","name":"KBTV","color":"#3582fe"},"season":1,"episode":27,"thumbnail":"1fa153ce624185d12ddb060fa0163573","length":["5:46"]},{"youtubeId":"kn3VwqGFuoM","vanityId":"kbtv-4-25-17","title":"KBTV Archives: S1 E26","description":"This is an older episode of KBTV, published 4/25/17.","date":"2017-04-25T00:00:00.000Z","type":"full episode","show":{"showId":"kbtv","name":"KBTV","color":"#3582fe"},"season":1,"episode":26,"thumbnail":"1fa153ce624185d12ddb060fa0163573","length":["8:49"]},{"youtubeId":"m_S2Izl-Gi4","vanityId":"kbtv-4-18-17","title":"KBTV Archives: S1 E25","description":"This is an older episode of KBTV, published 4/18/17.","date":"2017-04-18T00:00:00.000Z","type":"full episode","show":{"showId":"kbtv","name":"KBTV","color":"#3582fe"},"season":1,"episode":25,"thumbnail":"1fa153ce624185d12ddb060fa0163573","length":["8:09"]},{"youtubeId":"1zbgnP3w_Ls","vanityId":"kbtv-4-11-17","title":"KBTV Archives: S1 E24","description":"This is an older episode of KBTV, published 4/11/17.","date":"2017-04-11T00:00:00.000Z","type":"full episode","show":{"showId":"kbtv","name":"KBTV","color":"#3582fe"},"season":1,"episode":24,"thumbnail":"1fa153ce624185d12ddb060fa0163573","length":["10:16"]},{"youtubeId":"cMFHuAEBpLI","vanityId":"kbtv-4-4-17","title":"KBTV Archives: S1 E23","description":"This is an older episode of KBTV, published 4/4/17.","date":"2017-04-04T00:00:00.000Z","type":"full episode","show":{"showId":"kbtv","name":"KBTV","color":"#3582fe"},"season":1,"episode":23,"thumbnail":"1fa153ce624185d12ddb060fa0163573","length":["9:33"]},{"youtubeId":"yGfjT-Q0mdQ","vanityId":"kbtv-3-21-17","title":"KBTV Archives: S1 E22","description":"This is an older episode of KBTV, published 3/21/17.","date":"2017-03-21T00:00:00.000Z","type":"full episode","show":{"showId":"kbtv","name":"KBTV","color":"#3582fe"},"season":1,"episode":22,"thumbnail":"1fa153ce624185d12ddb060fa0163573","length":["7:46"]},{"youtubeId":"DLEHSYQYQD0","vanityId":"kbtv-3-7-17","title":"KBTV Archives: S1 E21","description":"This is an older episode of KBTV, published 3/7/17.","date":"2017-03-07T00:00:00.000Z","type":"full episode","show":{"showId":"kbtv","name":"KBTV","color":"#3582fe"},"season":1,"episode":21,"thumbnail":"1fa153ce624185d12ddb060fa0163573","length":["8:49"]},{"youtubeId":"uWS2HdyT7cU","vanityId":"kbtv-2-28-17","title":"KBTV Archives: S1 E20","description":"This is an older episode of KBTV, published 2/28/17.","date":"2017-02-28T00:00:00.000Z","type":"full episode","show":{"showId":"kbtv","name":"KBTV","color":"#3582fe"},"season":1,"episode":20,"thumbnail":"1fa153ce624185d12ddb060fa0163573","length":["5:45"]}]},{"title":"Watch Full Episodes","videos":[{"youtubeId":"X_8mkF4hECs","vanityId":"kbtv-9-13-16","title":"KBTV: The First Episode!","description":"This is an older episode of KBTV, published 9/13/16.","date":"2016-09-13T00:00:00.000Z","type":"full episode","show":{"showId":"kbtv","name":"KBTV","color":"#3582fe"},"season":1,"episode":1,"thumbnail":"1fa153ce624185d12ddb060fa0163573","length":["Special Episode","5:37"]},{"youtubeId":"74uFNANTjCU","vanityId":"kbtv-9-20-16","title":"KBTV Archives: S1 E2","description":"This is an older episode of KBTV, published 9/20/16.","date":"2016-09-20T00:00:00.000Z","type":"full episode","show":{"showId":"kbtv","name":"KBTV","color":"#3582fe"},"season":1,"episode":2,"thumbnail":"1fa153ce624185d12ddb060fa0163573","length":["7:00"]},{"youtubeId":"Y4Xe1vgBYE0","vanityId":"kbtv-9-27-16","title":"KBTV Archives: S1 E3","description":"This is an older episode of KBTV, published 9/27/16.","date":"2016-09-27T00:00:00.000Z","type":"full episode","show":{"showId":"kbtv","name":"KBTV","color":"#3582fe"},"season":1,"episode":3,"thumbnail":"1fa153ce624185d12ddb060fa0163573","length":["6:19"]},{"youtubeId":"GAQYLONOaPE","vanityId":"kbtv-10-11-16","title":"KBTV Archives: S1 E4","description":"This is an older episode of KBTV, published 10/11/16.","date":"2016-10-11T00:00:00.000Z","type":"full episode","show":{"showId":"kbtv","name":"KBTV","color":"#3582fe"},"season":1,"episode":4,"thumbnail":"1fa153ce624185d12ddb060fa0163573","length":["4:30"]},{"youtubeId":"mtncYfl7Kfg","vanityId":"kbtv-10-18-16","title":"KBTV Archives: S1 E5","description":"This is an older episode of KBTV, published 10/18/16.","date":"2016-10-18T00:00:00.000Z","type":"full episode","show":{"showId":"kbtv","name":"KBTV","color":"#3582fe"},"season":1,"episode":5,"thumbnail":"1fa153ce624185d12ddb060fa0163573","length":["5:47"]},{"youtubeId":"KwK9kpClAlI","vanityId":"kbtv-10-25-16","title":"KBTV Archives: S1 E6","description":"This is an older episode of KBTV, published 10/25/16.","date":"2016-10-25T00:00:00.000Z","type":"full episode","show":{"showId":"kbtv","name":"KBTV","color":"#3582fe"},"season":1,"episode":6,"thumbnail":"1fa153ce624185d12ddb060fa0163573","length":["6:09"]},{"youtubeId":"0S8e86PaYwk","vanityId":"kbtv-11-1-16","title":"KBTV Archives: S1 E7","description":"This is an older episode of KBTV, published 11/1/16.","date":"2016-11-01T00:00:00.000Z","type":"full episode","show":{"showId":"kbtv","name":"KBTV","color":"#3582fe"},"season":1,"episode":7,"thumbnail":"1fa153ce624185d12ddb060fa0163573","length":["6:28"]},{"youtubeId":"HHvos_eKO3E","vanityId":"kbtv-11-8-16","title":"KBTV Archives: S1 E8","description":"This is an older episode of KBTV, published 11/8/16.","date":"2016-11-08T00:00:00.000Z","type":"full episode","show":{"showId":"kbtv","name":"KBTV","color":"#3582fe"},"season":1,"episode":8,"thumbnail":"1fa153ce624185d12ddb060fa0163573","length":["6:53"]},{"youtubeId":"GA0C0nlsinE","vanityId":"kbtv-11-15-16","title":"KBTV Archives: S1 E9","description":"This is an older episode of KBTV, published 11/15/16.","date":"2016-11-15T00:00:00.000Z","type":"full episode","show":{"showId":"kbtv","name":"KBTV","color":"#3582fe"},"season":1,"episode":9,"thumbnail":"1fa153ce624185d12ddb060fa0163573","length":["5:47"]},{"youtubeId":"3bgsDbnB2LM","vanityId":"kbtv-11-29-16","title":"KBTV Archives: S1 E10","description":"This is an older episode of KBTV, published 11/29/16.","date":"2016-11-29T00:00:00.000Z","type":"full episode","show":{"showId":"kbtv","name":"KBTV","color":"#3582fe"},"season":1,"episode":10,"thumbnail":"1fa153ce624185d12ddb060fa0163573","length":["7:04"]},{"youtubeId":"aZWU86kuk8k","vanityId":"kbtv-12-6-16","title":"KBTV Archives: S1 E11","description":"This is an older episode of KBTV, published 12/6/16.","date":"2016-12-06T00:00:00.000Z","type":"full episode","show":{"showId":"kbtv","name":"KBTV","color":"#3582fe"},"season":1,"episode":11,"thumbnail":"1fa153ce624185d12ddb060fa0163573","length":["9:32"]},{"youtubeId":"GCO3RUGU3IE","vanityId":"kbtv-12-20-16","title":"KBTV Archives: S1 E12","description":"This is an older episode of KBTV, published 12/20/16.","date":"2016-12-20T00:00:00.000Z","type":"full episode","show":{"showId":"kbtv","name":"KBTV","color":"#3582fe"},"season":1,"episode":12,"thumbnail":"1fa153ce624185d12ddb060fa0163573","length":["11:54"]}]},{"title":"Go Back in Time","videos":[{"youtubeId":"X_8mkF4hECs","vanityId":"kbtv-9-13-16","title":"KBTV: The First Episode!","description":"This is an older episode of KBTV, published 9/13/16.","date":"2016-09-13T00:00:00.000Z","type":"full episode","show":{"showId":"kbtv","name":"KBTV","color":"#3582fe"},"season":1,"episode":1,"thumbnail":"1fa153ce624185d12ddb060fa0163573","length":["Special Episode","5:37"]},{"youtubeId":"74uFNANTjCU","vanityId":"kbtv-9-20-16","title":"KBTV Archives: S1 E2","description":"This is an older episode of KBTV, published 9/20/16.","date":"2016-09-20T00:00:00.000Z","type":"full episode","show":{"showId":"kbtv","name":"KBTV","color":"#3582fe"},"season":1,"episode":2,"thumbnail":"1fa153ce624185d12ddb060fa0163573","length":["7:00"]},{"youtubeId":"Y4Xe1vgBYE0","vanityId":"kbtv-9-27-16","title":"KBTV Archives: S1 E3","description":"This is an older episode of KBTV, published 9/27/16.","date":"2016-09-27T00:00:00.000Z","type":"full episode","show":{"showId":"kbtv","name":"KBTV","color":"#3582fe"},"season":1,"episode":3,"thumbnail":"1fa153ce624185d12ddb060fa0163573","length":["6:19"]},{"youtubeId":"GAQYLONOaPE","vanityId":"kbtv-10-11-16","title":"KBTV Archives: S1 E4","description":"This is an older episode of KBTV, published 10/11/16.","date":"2016-10-11T00:00:00.000Z","type":"full episode","show":{"showId":"kbtv","name":"KBTV","color":"#3582fe"},"season":1,"episode":4,"thumbnail":"1fa153ce624185d12ddb060fa0163573","length":["4:30"]},{"youtubeId":"mtncYfl7Kfg","vanityId":"kbtv-10-18-16","title":"KBTV Archives: S1 E5","description":"This is an older episode of KBTV, published 10/18/16.","date":"2016-10-18T00:00:00.000Z","type":"full episode","show":{"showId":"kbtv","name":"KBTV","color":"#3582fe"},"season":1,"episode":5,"thumbnail":"1fa153ce624185d12ddb060fa0163573","length":["5:47"]},{"youtubeId":"KwK9kpClAlI","vanityId":"kbtv-10-25-16","title":"KBTV Archives: S1 E6","description":"This is an older episode of KBTV, published 10/25/16.","date":"2016-10-25T00:00:00.000Z","type":"full episode","show":{"showId":"kbtv","name":"KBTV","color":"#3582fe"},"season":1,"episode":6,"thumbnail":"1fa153ce624185d12ddb060fa0163573","length":["6:09"]},{"youtubeId":"0S8e86PaYwk","vanityId":"kbtv-11-1-16","title":"KBTV Archives: S1 E7","description":"This is an older episode of KBTV, published 11/1/16.","date":"2016-11-01T00:00:00.000Z","type":"full episode","show":{"showId":"kbtv","name":"KBTV","color":"#3582fe"},"season":1,"episode":7,"thumbnail":"1fa153ce624185d12ddb060fa0163573","length":["6:28"]},{"youtubeId":"HHvos_eKO3E","vanityId":"kbtv-11-8-16","title":"KBTV Archives: S1 E8","description":"This is an older episode of KBTV, published 11/8/16.","date":"2016-11-08T00:00:00.000Z","type":"full episode","show":{"showId":"kbtv","name":"KBTV","color":"#3582fe"},"season":1,"episode":8,"thumbnail":"1fa153ce624185d12ddb060fa0163573","length":["6:53"]},{"youtubeId":"GA0C0nlsinE","vanityId":"kbtv-11-15-16","title":"KBTV Archives: S1 E9","description":"This is an older episode of KBTV, published 11/15/16.","date":"2016-11-15T00:00:00.000Z","type":"full episode","show":{"showId":"kbtv","name":"KBTV","color":"#3582fe"},"season":1,"episode":9,"thumbnail":"1fa153ce624185d12ddb060fa0163573","length":["5:47"]},{"youtubeId":"3bgsDbnB2LM","vanityId":"kbtv-11-29-16","title":"KBTV Archives: S1 E10","description":"This is an older episode of KBTV, published 11/29/16.","date":"2016-11-29T00:00:00.000Z","type":"full episode","show":{"showId":"kbtv","name":"KBTV","color":"#3582fe"},"season":1,"episode":10,"thumbnail":"1fa153ce624185d12ddb060fa0163573","length":["7:04"]},{"youtubeId":"aZWU86kuk8k","vanityId":"kbtv-12-6-16","title":"KBTV Archives: S1 E11","description":"This is an older episode of KBTV, published 12/6/16.","date":"2016-12-06T00:00:00.000Z","type":"full episode","show":{"showId":"kbtv","name":"KBTV","color":"#3582fe"},"season":1,"episode":11,"thumbnail":"1fa153ce624185d12ddb060fa0163573","length":["9:32"]},{"youtubeId":"GCO3RUGU3IE","vanityId":"kbtv-12-20-16","title":"KBTV Archives: S1 E12","description":"This is an older episode of KBTV, published 12/20/16.","date":"2016-12-20T00:00:00.000Z","type":"full episode","show":{"showId":"kbtv","name":"KBTV","color":"#3582fe"},"season":1,"episode":12,"thumbnail":"1fa153ce624185d12ddb060fa0163573","length":["11:54"]}]}]},"video":{"youtubeId":"Y4Xe1vgBYE0","vanityId":"kbtv-9-27-16","title":"KBTV Archives: S1 E3","description":"This is an older episode of KBTV, published 9/27/16.","date":"2016-09-27T00:00:00.000Z","type":"full episode","show":{"showId":"kbtv","name":"KBTV","color":"#3582fe"},"season":1,"episode":3,"thumbnail":"1fa153ce624185d12ddb060fa0163573","length":["6:19"]}},"__N_SSG":true}